{
  "schema_version": 1,
  "id": "GP-X42",
  "seed": null,
  "title": "An altered source revision cannot reuse a frozen receipt",
  "situation": "An exact reduced-row binding is conditional on normalized-root inputs; the original-pair to normalized-root map remains unmaterialized.",
  "inputs": {
    "source_pair_materialized": false,
    "source_map_materialized": false,
    "proposed_value": "0000000000000000000000000000000000000000"
  },
  "attempted_conclusion": "Accept the existing seam fixture after replacing its source revision.",
  "expected": {
    "verdict": "REFUSE",
    "reason": "The frozen receipt binds the original revision."
  },
  "scope_or_region": "BOTH",
  "sources": [
    {
      "repository": "gp-history",
      "commit": "7991c9052f13e8dcaa78b5eae36f31663e080c1e",
      "path": "tests/test_jc_original_pair_seam.py",
      "line": 141,
      "anchor": "def test_changing_the_native_commit_binding_is_rejected("
    }
  ]
}
