{
  "schema_version": 1,
  "id": "GP-X193",
  "seed": null,
  "title": "Independent place and order omissions remain visible",
  "situation": "The t place, interior order -4 and nonnegative orders 0,1,2 are used but absent from their respective inventories.",
  "inputs": {
    "scenario": "coverage_inventory",
    "asserted_dimensions": [
      "place",
      "order"
    ],
    "represented_indices": {
      "place": [
        "y",
        "infinity"
      ],
      "order": [
        "-1",
        "-2",
        "-3",
        "-5"
      ]
    },
    "construction_uses": [
      {
        "dimension": "place",
        "indices": [
          "y",
          "t"
        ],
        "description": "coordinate change"
      },
      {
        "dimension": "order",
        "indices": [
          "-1",
          "-2",
          "-3",
          "-4",
          "-5"
        ],
        "description": "coefficient family"
      }
    ],
    "conclusion_uses": [
      {
        "dimension": "order",
        "indices": [
          "0",
          "1",
          "2"
        ],
        "description": "required nonnegative slices"
      }
    ]
  },
  "attempted_conclusion": "The recorded uses are covered by the declared index inventory on all asserted dimensions.",
  "expected": {
    "verdict": "REFUSE",
    "reason": "The t place, interior order -4 and nonnegative orders 0,1,2 are used but absent from their respective inventories."
  },
  "scope_or_region": "N/A",
  "sources": [
    {
      "repository": "gp-v037",
      "commit": "ac4155787207e2847d248cffed7be871d5dcd577",
      "path": "tests/test_retrodiction.py",
      "line": 154,
      "anchor": "def test_each_axis_is_necessary_the_other_cannot_cover_for_it("
    }
  ]
}
