{
  "schema_version": 1,
  "id": "GP-X274",
  "seed": null,
  "title": "Negative selected roots do not cover the positive root",
  "situation": "Equal polynomial ideals need not describe equal selected real point sets. Coverage must respect the isolated root selected by each model.",
  "inputs": {
    "parent": {
      "field": "Q",
      "variables": [
        "x"
      ],
      "equations": [
        "x^2-2"
      ],
      "selected_real_interval": [
        "1",
        "2"
      ]
    },
    "branches": [
      {
        "field": "Q",
        "variables": [
          "x"
        ],
        "equations": [
          "x^2-2"
        ],
        "selected_real_interval": [
          "-2",
          "-1"
        ]
      },
      {
        "field": "Q",
        "variables": [
          "x"
        ],
        "equations": [
          "x^2-2"
        ],
        "selected_real_interval": [
          "-2",
          "-1"
        ]
      }
    ]
  },
  "attempted_conclusion": "The declared selected branch loci cover every selected point of the parent.",
  "expected": {
    "verdict": "REFUSE",
    "reason": "Negative selected roots do not cover the positive root"
  },
  "scope_or_region": "REGION",
  "sources": [
    {
      "repository": "gp-v037",
      "commit": "ac4155787207e2847d248cffed7be871d5dcd577",
      "path": "grandportage/verify.py",
      "line": 1516,
      "anchor": "def partition_exhaustiveness(graph, pid, timeout=300, _runner=None, _backend=None):"
    }
  ]
}
