{
  "schema_version": 1,
  "id": "GP-X336",
  "seed": null,
  "title": "Changed quotient modulus cannot retain finite unit witness",
  "situation": "The finite algebra K[Z]/(r_final) is part of the witness. Its first modulus coefficient is changed to one while the same sliced equations and Omega8 unit claim are retained.",
  "inputs": {
    "control": "modulus",
    "fixture_sha256": "ce082feccd226db1bd8e0749b652ae806e896a79053a0ed7454c5a1288e686b6",
    "mutation": {
      "op": "set",
      "path": [
        "pullback_certificate",
        "witness",
        "r_final",
        0
      ],
      "value": "1"
    }
  },
  "attempted_conclusion": "Reuse the same finite-quotient witness after changing r_final.",
  "expected": {
    "verdict": "REFUSE",
    "reason": "The modified modulus fails the historical joint finite-witness check at W3."
  },
  "scope_or_region": "REGION",
  "sources": [
    {
      "repository": "gp-history",
      "commit": "7991c9052f13e8dcaa78b5eae36f31663e080c1e",
      "path": "tests/test_jc_h3_b0_depth8_residual.py",
      "line": 111,
      "anchor": "def test_changed_finite_algebra_modulus_refuses("
    },
    {
      "repository": "gp-history",
      "commit": "7991c9052f13e8dcaa78b5eae36f31663e080c1e",
      "path": "experiments/jc_h3_b0_free_plane/depth8_residual_adapter.py",
      "line": 801,
      "anchor": "eval_xy(sliced[\"sliced_Phi\"]) == [KZERO], \"W3\","
    },
    {
      "repository": "gp-history",
      "commit": "7991c9052f13e8dcaa78b5eae36f31663e080c1e",
      "path": "experiments/jc_h3_b0_free_plane/depth8_residual_adapter.py",
      "line": 816,
      "anchor": "len(kpoly_gcd(denominator_image, modulus)) - 1 == 0, \"W5\","
    }
  ]
}
