{
  "schema_version": 1,
  "id": "GP-X222",
  "seed": null,
  "title": "Exact cofactor proof is current with matching local backend",
  "situation": "Separate replayable polynomial evidence from the availability and identity of its historical producer.",
  "inputs": {
    "model": {
      "field": "Q",
      "variables": [
        "x"
      ],
      "equations": [
        "x"
      ]
    },
    "identity": {
      "left": "x^2",
      "right": "0"
    },
    "cofactors": [
      "x"
    ],
    "local_backend": "matching",
    "historical_identity": "identified",
    "raw_artifact": "present",
    "question": "exact_identity_current"
  },
  "attempted_conclusion": "Accept x^2=0 modulo the ideal (x) from the supplied cofactor identity.",
  "expected": {
    "verdict": "ACCEPT",
    "reason": "Exact cofactor proof is current with matching local backend"
  },
  "scope_or_region": "N/A",
  "sources": [
    {
      "repository": "gp-v037",
      "commit": "ac4155787207e2847d248cffed7be871d5dcd577",
      "path": "tests/test_artifacts.py",
      "line": 192,
      "anchor": "def test_exact_identity_receipt_survives_local_backend_state("
    }
  ]
}
