{
  "schema_version": 1,
  "id": "GP-X291",
  "seed": null,
  "title": "Incorrect binary product identity refuses",
  "situation": "Exact product equality and branch construction are distinct operations. The construction request uses a matching parent generator and supplies no ideal-membership witness.",
  "inputs": {
    "variables": [
      "x",
      "y",
      "z"
    ],
    "characteristic": 0,
    "declared_units": [
      "z"
    ],
    "identity": {
      "equation": "x*y+1",
      "scalar": "1",
      "left": "x",
      "right": "y"
    },
    "parent_equations": [
      "x*y"
    ],
    "open_guards": [
      "z"
    ],
    "question": "check_identity"
  },
  "attempted_conclusion": "Verify the supplied product identity only.",
  "expected": {
    "verdict": "REFUSE",
    "reason": "Incorrect binary product identity refuses"
  },
  "scope_or_region": "SCOPE",
  "sources": [
    {
      "repository": "gp-v037",
      "commit": "ac4155787207e2847d248cffed7be871d5dcd577",
      "path": "grandportage/product_split.py",
      "line": 49,
      "anchor": "def verify(spec):"
    }
  ]
}
